{
  "unitOfMeasureIsOmitted" : false,
  "demandRate" : {
    "demandRateCode" : "WKS"
  },
  "unitOfMeasure" : "unit:piece",
  "materialDescriptionCustomer" : "Spark Plug",
  "materialGlobalAssetId" : "urn:uuid:48878d48-6f1d-47f5-8ded-a441d0d879df",
  "materialDemandId" : "0157ba42-d2a8-4e28-8565-7b07830c1110",
  "materialNumberSupplier" : "MNR-8101-ID146955.001",
  "supplier" : "BPNL6666666666YY",
  "changedAt" : "2023-11-05T08:15:30.123-05:00",
  "demandSeries" : [ {
    "expectedSupplierLocation" : "BPNS8888888888XX",
    "demands" : [ {
      "demand" : 1000,
      "pointInTime" : "2023-10-09"
    } ],
    "customerLocation" : "BPNS8888888888XX",
    "demandCategory" : {
      "demandCategoryCode" : "0001"
    }
  } ],
  "materialNumberCustomer" : "MNR-7307-AU340474.002",
  "customer" : "BPNL8888888888XX"
}